keywords;title;description;modified;Typ;Kontakt;URL
Wald und Holz;Waldbrände;Die Waldbrandstatistik ist für den Forstdienst und die Feuerwehr ein wichtiges Instrument für die Waldbrandprävention, für die Planung der technischen Brandbekämpfung sowie für die Optimierung der Brandbekämpfungsstrategie. In diesem Kontext ist zu präzisieren, dass die meisten Flur- und Waldbrände in der Schweiz auf menschliche Ursachen zurückzuführen sind. Die Waldbrände können die Waldfunktionen beeinträchtigen (bspw. Minderung der Schutzfunktion) sowie Schaden an Infrastrukturanlagen und Bauten im Wald verursachen.;2024-02-29 00:00:00.000;Indikator;data@bafu.admin.ch;https://www.bafu.admin.ch/bafu/de/home/zustand/indikatoren.html/
Wald und Holz;Importkontrolle von Holzverpackungen;Besonders gefährliche Schadorganismen wie der Asiatische Laubholzbockkäfer bedrohen unsere Waldökosysteme. Um deren Einschleppung zu verhindern, müssen Holzverpackungen im internationalen Warenverkehr behandelt und markiert sein. Der Eidgenössische Pflanzenschutzdienst (EPSD;;Indikator;data@bafu.admin.ch;https://www.bafu.admin.ch/bafu/de/home/zustand/indikatoren.html/
Wald und Holz;Phytosanitäre Kontrolle in Baumschulen;Besonders gefährliche Schadorganismen wie der Citrusbockkäfer bedrohen unsere Waldökosysteme. Um deren Einschleppung durch den Pflanzenhandel zu verhindern, werden Baumschulen jährlich kontrolliert. Bei Befall verfügt der Eidgenössische Pflanzenschutzdienst EPSD (ein Dienst des BAFU und des BLW) Tilgungsmassnahmen und macht Nachkontrollen. Eine betroffene Baumschule darf bis zur Nachkontrolle nicht mit den betroffenen Pflanzengattungen Handel treiben.;2024-11-18 00:00:00.000;Indikator;data@bafu.admin.ch;https://www.bafu.admin.ch/bafu/de/home/zustand/indikatoren.html/
Wald und Holz;Vielfalt von Artengemeinschaften im Wald;Die Einzigartigkeit eines Lebensraums zeigt sich an der besonderen, standortspezifischen und historisch gewachsenen Artenzusammensetzung. Insbesondere Arten, die selten vorkommen, verleihen einem Standort einen speziellen Charakter. Wenn Arten, die häufig vorkommen, sich noch stärker ausbreiten, teilweise auch zu Lasten von seltenen Arten, werden die Artengemeinschaften immer gleichförmiger und banaler und ihre lokale Eigenart geht verloren.Zu den Ursachen für die Homogenisierung von Artengemeinschafte gehören das lokale Aussterben seltener Arten, der gleichmässige Eintrag von Stickstoff über die Luft, die Intensivierung der Nutzung, der Verlust lokaler Bewirtschaftungsformen und die Ausbreitung bereits weit verbreiteter Arten durch den Menschen.;2024-09-20 00:00:00.000;Indikator;data@bafu.admin.ch;https://www.bafu.admin.ch/bafu/de/home/zustand/indikatoren.html/
Wald und Holz;Übrige Erträge der Forstbetriebe;;2024-10-10 00:00:00.000;Indikator;data@bafu.admin.ch;https://www.bafu.admin.ch/bafu/de/home/zustand/indikatoren.html/
Wasser;Trinkwasserverbrauch;Trinkwasser wird intensiv und vielfältig genutzt. In den Haushalten wird es zum Trinken, zum Kochen, zu Hygienezwecken, zum Putzen und zum Bewässern verwendet. Auch in Industrie und Gewerbe wird Trinkwasser genutzt, ebenso in öffentlichen Dienstleistungsbetrieben, etwa zur Speisung von Brunnen, zur Bewässerung und zur Reinigung von Infrastrukturen. Als Wasserschloss Europas verfügt die Schweiz über bedeutende Wasserressourcen. Da die Verfügbarkeit dieser Ressourcen je nach Jahreszeit und geografischer Lage erheblich variiert, besteht die grösste Herausforderung darin, das Wasser am richtigen Ort, zum richtigen Zeitpunkt sowie in der erforderlichen Menge und Qualität bereitzustellen.;;Indikator;data@bafu.admin.ch;https://www.bafu.admin.ch/bafu/de/home/zustand/indikatoren.html/
Wasser;Strukturen der Fliessgewässer;In der Vergangenheit wurden zahlreiche Fliessgewässer begradigt und verbaut, um die Nutzung überschwemmungsgefährdeter Flächen für Siedlungen, Infrastrukturbauten und die Landwirtschaft zu ermöglichen und um sie zur Stromgewinnung zu nutzen. Dadurch können sie viele ihrer natürlichen Funktionen nicht mehr erfüllen, und die Lebensräume für Pflanzen und Tiere im und ums Wasser verarmen. Das Landschaftsbild wird monotoner. Hindernisse wie Schwellen, Flusskraftwerke, Staudämme und andere Querbauwerke behindern die Wanderung von schwimmenden Wasserorganismen zwischen Unter- und Oberlauf, was ihre Fortpflanzung sowie auch die Ausbreitung und Vermischung von Populationen erheblich beeinträchtigt.;2020-08-27 00:00:00.000;Indikator;data@bafu.admin.ch;https://www.bafu.admin.ch/bafu/de/home/zustand/indikatoren.html/
Wasser;Hochwasser;Hochwasser richten grosse Schäden durch Überschwemmungen an. Oft können sie gar Leben gefährden sowie Bauten beschädigen und zerstören. Fundamente von Bauwerken können durch Ufer- und Tiefenerosion unterspült werden. Das vom Hochwasser mitgeschleppte Geschiebe (Steine und Schlamm) sowie Treibholz beschädigen Kulturland und Bauten. Andererseits haben Hochwasser auch ökologische Funktionen, indem sie zum Beispiel Auen regelmässig überfluten oder die Gerinnemorphologie verändern. Hochwasserhäufigkeit und –ausmass sind eng gekoppelt an klimatische Veränderungen (beispielsweise natürliche Veränderungen der atmosphärischen Zirkulation sowie vom Menschen verursachte Erwärmung).;2024-02-05 00:00:00.000;Indikator;data@bafu.admin.ch;https://www.bafu.admin.ch/bafu/de/home/zustand/indikatoren.html/
Wasser;Niedrigwasser;Als Niedrigwasser bezeichnet man Wasserstand und Abflussverhältnisse von Gewässern, die deutlich unter dem Normalzustand liegen. Ausgeprägte Niedrigwasser, die beispielsweise als Folge langer Trockenheitsperioden auftreten, haben starke Auswirkungen auf die Ökosysteme der Gewässer. Betroffen ist etwa die Fischfauna, die durch sinkende Wasserstände bedroht sein kann. Aber auch die Wassernutzung kann durch Niedrigwasser beeinträchtigt werden: Beispielsweise kann es zu Engpässen bei landwirtschaftlichen Bewässerungen oder bei der Wasserkraftnutzung kommen. Sollte die Häufigkeit von Niedrigwasser zunehmen, würde sich die Konkurrenzsituation zwischen dem Wasserbedarf der Ökosysteme und den verschiedenen Verbrauchern verschärfen.;;Indikator;data@bafu.admin.ch;https://www.bafu.admin.ch/bafu/de/home/zustand/indikatoren.html/
Wasser;Mittlerer Abfluss;Als mittleren Abfluss bezeichnet man die Wassermenge, die im Durchschnitt während eines Jahres oder einer Saison abfliesst. Sie hängt natürlicherweise ab von der im Gebiet gefallenen Niederschlagsmenge und wie viel davon durch Verdunstung oder langfristige Speicherung (z. B. in Gletschern) dem Abfluss verloren geht. Sie kann aber auch vom Menschen beeinflusst werden, beispielsweise durch wasserwirtschaftliche Eingriffe (z. B. Bewässerung, Wasserumleitungen, Wasserrückhalt in Stauseen oder Seeregulierungen). Der Abfluss und seine Verteilung über die Jahreszeiten sind wichtige Parameter für die Gewässerökologie und die Wasserwirtschaft (Wasserkraft, Trinkwassernutzung, Bewässerung, Schifffahrt). Lange Zeitreihen des Abflusses zeigen auf, wie sich der Wasserhaushalt aufgrund der erwähnten Einflüsse verändert.;;Indikator;data@bafu.admin.ch;https://www.bafu.admin.ch/bafu/de/home/zustand/indikatoren.html/
Wasser;Wasserbilanz und Wasserspeicher;;2024-06-13 00:00:00.000;Indikator;data@bafu.admin.ch;https://www.bafu.admin.ch/bafu/de/home/zustand/indikatoren.html/
Wasser;Nährstoffe in Fliessgewässer;Nitrat und Phosphat in Fliessgewässern sind gute Indikatoren der anthropogenen, d.h. vom Menschen verursachten Nährstoffbelastung eines Gewässers. Nährstoffe gelangen in die Gewässer durch kommunale Abwässer sowie durch Eintrag aus intensiv gedüngten landwirtschaftlichen Nutzflächen. In einem Fliessgewässer hat eine erhöhte Nitrat- oder Phosphatkonzentration im Normalfall keinen negativen Einfluss. In stehenden Gewässern hingegen können hohe Phosphateinträge zu Eutrophierung führen. Ausserdem tragen Nährstoffe zur Verschmutzung der Meere bei, in die die Flüsse münden.;2024-04-18 00:00:00.000;Indikator;data@bafu.admin.ch;https://www.bafu.admin.ch/bafu/de/home/zustand/indikatoren.html/
Wasser;Hohe Seepegelstände;;2024-04-25 00:00:00.000;Indikator;data@bafu.admin.ch;https://www.bafu.admin.ch/bafu/de/home/zustand/indikatoren.html/
Wasser;Flüchtige halogenierte Kohlenwasserstoffe im Grundwasser;Flüchtige organische Substanzen werden unter anderem als Lösungsmittel, Kühlmittel oder Rohstoff in Industrie und Gewerbe eingesetzt. Auch in Treibstoffen sind diese Substanzen enthalten.Ins Grundwasser können sie durch unsachgemässe Handhabung bei Produktion, Transport oder Lagerung sowie beim Gebrauch und der Entsorgung gelangen. Insbesondere flüchtige halogenierte Kohlenwasserstoffe (FHKW) aus Altlasten können das Grundwasser verunreinigen. Grundwasser ist die wichtigste Trinkwasserressource der Schweiz. Über 80% des Trinkwassers in der Schweiz wird aus Grundwasser gewonnen.;2024-05-03 00:00:00.000;Indikator;data@bafu.admin.ch;https://www.bafu.admin.ch/bafu/de/home/zustand/indikatoren.html/
Wasser;Nitrat im Grundwasser;Grundwasser enthält von Natur aus nur wenige Milligramm Nitrat pro Liter. Ins Grundwasser gelangt Nitrat hauptsächlich durch den Einsatz von Stickstoff-haltigem Hof- und Mineraldünger in der Landwirtschaft. Wird mehr Dünger ausgebracht als die Pflanzen aufnehmen können, so wird der überschüssige Stickstoff in Form von Nitrat aus dem Boden ausgewaschen und mit dem Sickerwasser ins Grundwasser verlagert. Auch die Deposition von Stickoxiden und Ammoniak aus der Luft lässt den Stickstoff-Gehalt im Boden und damit das Risiko steigen, dass Nitrat ins Grundwasser ausgewaschen wird. Grundwasser ist die wichtigste Trinkwasserressource der Schweiz. Über 80% des Trinkwassers in der Schweiz wird aus Grundwasser gewonnen.;2024-05-03 00:00:00.000;Indikator;data@bafu.admin.ch;https://www.bafu.admin.ch/bafu/de/home/zustand/indikatoren.html/
Wasser;Grundwassertemperatur;Die Grundwassertemperatur ist eine wesentliche Eigenschaft des Grundwassers und ein wichtiger Einflussfaktor auf dessen hydrochemischen und biologischen Zustand und seine Nutzung als Trinkwasser. Sie hat Auswirkungen auf den Anteil an gelöstem Sauerstoff im Wasser sowie auf den Grad der Mineralisierung. Mit höherer Temperatur kann sich zudem die mikrobielle Aktivität im Grundwasser – ein Indikator für die Grundwasserqualität – verändern und die sehr wärmeempfindliche Stygofauna (Tiere, die nur im Grundwasser leben) beeinträchtigt werden. Die Beobachtung der Entwicklung der Grundwassertemperatur ist insbesondere vor dem Hintergrund der Klimaänderung bzw. der zunehmenden thermischen Nutzungen im Untergrund von Bedeutung.  ;2024-09-27 00:00:00.000;Indikator;data@bafu.admin.ch;https://www.bafu.admin.ch/bafu/de/home/zustand/indikatoren.html/
Wasser;Grundwasserstände und Quellabflüsse;Der Indikator liefert im Jahresvergleich einen landesweiten Überblick zur Häufigkeit des Auftretens von tiefen, normalen und hohen Grundwasserverhältnissen. Sinkt das Grundwasser infolge ausgeprägter Trockenheit überdurchschnittlich ab, kann dies zu Engpässen in der Wasserversorgung führen und grundwasserabhängige Ökosysteme negativ beeinträchtigen. Steigt das Grundwasser infolge überdurchschnittlich starker Niederschläge massiv an, kann es zu erheblichen Flur- und Gebäudeschäden kommen. Zudem können in Hanglagen oberflächennahe Rutschungen und Murgänge ausgelöst werden.;2024-09-26 00:00:00.000;Indikator;data@bafu.admin.ch;https://www.bafu.admin.ch/bafu/de/home/zustand/indikatoren.html/
Wasser;Qualität der Badegewässer;Die Erhebungen zur Badegewässerqualität beurteilen die hygienische Qualität der Gewässer anhand der E.Coli und intestinalen Enterokokken. Sie geben Hinweise darauf, wie gut Gewässerschutzmassnahmen greifen, und insbesondere wieweit die Abwasserreinigungsanlagen ihre Funktion erfüllen. Eine gute hygienische Qualität der Badegewässer ist essentiell, damit die Bevölkerung ohne Gesundheitsrisiko in den Flüssen und Seen baden kann.;2024-10-16 00:00:00.000;Indikator;data@bafu.admin.ch;https://www.bafu.admin.ch/bafu/de/home/zustand/indikatoren.html/
Wasser;Abflussvorhersage;Eine wichtige Massnahme, um Schäden bei Hochwasser möglichst gering zu halten, ist die Warnung und Alarmierung. Diese basieren unter anderem auf Vorhersagen von Abflüssen und Seeständen. Damit Warnungen am richtigen Ort ausgelöst werden können, muss die räumliche Auflösung der hydrologischen Vorhersagen möglichst gross sein. Es ist daher anzustreben, hydrologische Vorhersagen an möglichst vielen Pegel-Messstellen entlang der grösseren Gewässer der Schweiz zu haben.;2024-02-05 00:00:00.000;Indikator;data@bafu.admin.ch;https://www.bafu.admin.ch/bafu/de/home/zustand/indikatoren.html/
Wasser;Regionalisierung der Abwasserreinigung;Die Abwasserreinigung in der Schweiz befindet sich auf einem hohen Niveau und gewährleistet einen effizienten Gewässerschutz. Um diese Effizienz beizubehalten oder zu steigern, ist eine professionelle und wirtschaftliche Organisation der Abwasserentsorgung notwendig. Es wird angenommen, dass regionale Strukturen (gemeindeüberschreitende Organisationsformen und grössere Anlagen) dies besser gewährleisten können als kommunale und kleinräumige Strukturen mit vielen kleinen Anlagen. Der Indikator erlaubt also eine Aussage über die Wirtschaftlichkeit und Professionalität der Abwasserentsorgung.;2024-06-21 00:00:00.000;Indikator;data@bafu.admin.ch;https://www.bafu.admin.ch/bafu/de/home/zustand/indikatoren.html/
Wasser;Anschlussgrad an Abwasserreinigungsanlagen;Abwasserreinigungsanlagen (ARA) reinigen das Abwasser von Industrie, Gewerbe und Haushalten so effizient, dass das gereinigte Wasser in ein natürliches Gewässer eingeleitet werden kann. Zwar können nicht alle Schadstoffe vollständig eliminiert werden, doch kann ein guter technischer Ausbaugrad der Anlagen den Schadstoffeintrag in die Gewässer stark reduzieren. Auf diese Weise konnte die Gewässerqualität in der Schweiz in den letzten 50 Jahren signifikant verbessert werden.;2021-06-28 00:00:00.000;Indikator;data@bafu.admin.ch;https://www.bafu.admin.ch/bafu/de/home/zustand/indikatoren.html/
Wasser;Exportierte Stickstoff-Fracht;Die Nährstoff-Einträge in die Gewässer haben nicht nur lokale Auswirkungen, sondern tragen durch ihren Transport in den Strömen zur Meeresbelastung bei. Messungen im Rahmen der Nationalen Daueruntersuchung Fliessgewässer NADUF am Rhein bei Basel illustrieren, dass die Stickstofffrachten seit den 1980er Jahren abnahmen. Diese Entwicklung ist vor allem auf den Ausbau der Abwasserreinigung zurückzuführen. Um die Belastung der Meere zu vermindern, müssen die Nitrat-Einträge aus Siedlung und Landwirtschaft reduziert werden. Eine solche Reduktion ist nötig, um das Ziel des „Abkommens zum Schutz der Meeresumwelt des Nordost-Atlantiks“ (OSPAR) zu erreichen, das in einer Halbierung der Stickstoffeinträge gegenüber 1985 besteht.  ;2024-11-21 00:00:00.000;Indikator;data@bafu.admin.ch;https://www.bafu.admin.ch/bafu/de/home/zustand/indikatoren.html/
Wasser;Sanierung Restwasser;;2024-09-30 00:00:00.000;Indikator;data@bafu.admin.ch;https://www.bafu.admin.ch/bafu/de/home/zustand/indikatoren.html/
Wasser;Sanierung Schwall-Sunk;;2024-10-16 00:00:00.000;Indikator;data@bafu.admin.ch;https://www.bafu.admin.ch/bafu/de/home/zustand/indikatoren.html/
Wasser;Temperatur von Fliessgewässern;Die Wassertemperatur ist ein Schlüsselfaktor für den Zustand eines Fliessgewässers. Alle Stoffwechselvorgänge, das Wachstum sowie die Zusammensetzung der Lebensgemeinschaften werden von ihr beeinflusst. Wenn die Temperaturgrenzen für eine bestimmte Art überschritten werden und diese nicht in kühlere Gewässer flüchten kann, kann sie nicht überleben.;2024-09-26 00:00:00.000;Indikator;data@bafu.admin.ch;https://www.bafu.admin.ch/bafu/de/home/zustand/indikatoren.html/
Wasser;Schneemenge;Das Schneewasseräquivalent (SWE) ist die Wassermenge, die man erhalten würde, wenn man eine Schneedecke schmelzen würde. Der Indikator zeigt, dass das SWE im Vergleichsmonat März in den letzten 20 Jahren abgenommen hat. Die Variabilität von Jahr zu Jahr ist sehr gross aber der negative Trend ist auf allen Höhenstufen eindeutig erkennbar. Mit fortschreitendem Klimawandel dürfte sich dieser Trend in Zukunft fortsetzen.;2024-05-01 00:00:00.000;Indikator;data@bafu.admin.ch;https://www.bafu.admin.ch/bafu/de/home/zustand/indikatoren.html/
Wasser;Biologischer Zustand der Fliessgewässer;Anhand der Bioindikatoren Kieselalgen, Makrozoobenthos, Wasserpflanzen und Fische lässt sich beurteilen, wie gut ein Gewässer seine Funktion als Lebensraum für Tiere und Pflanzen erfüllt und ob die ökologischen Ziele der Gewässerschutzverordnung (GSchV) erreicht werden.;2022-04-19 00:00:00.000;Indikator;data@bafu.admin.ch;https://www.bafu.admin.ch/bafu/de/home/zustand/indikatoren.html/
Wasser;Von Spurenstoffen entlastete Abwassereinleitungen;;2024-10-10 00:00:00.000;Indikator;data@bafu.admin.ch;https://www.bafu.admin.ch/bafu/de/home/zustand/indikatoren.html/
Wasser;Messstationen Wasserstand und Abfluss an Oberflächengewässern;;2024-02-15 00:00:00.000;Indikator;data@bafu.admin.ch;https://www.bafu.admin.ch/bafu/de/home/zustand/indikatoren.html/
Wasser;Messstationen Oberflächengewässerqualität NADUF/NAWA;;2024-02-15 00:00:00.000;Indikator;data@bafu.admin.ch;https://www.bafu.admin.ch/bafu/de/home/zustand/indikatoren.html/
Wasser;Messstationen Grundwasserquantität NAQUA;;2024-10-10 00:00:00.000;Indikator;data@bafu.admin.ch;https://www.bafu.admin.ch/bafu/de/home/zustand/indikatoren.html/
Wasser;Messstationen Grundwasserqualität NAQUA;;2024-10-10 00:00:00.000;Indikator;data@bafu.admin.ch;https://www.bafu.admin.ch/bafu/de/home/zustand/indikatoren.html/
Wasser;Sanierung Fischgängigkeit (Fischabstieg);;2024-10-08 00:00:00.000;Indikator;data@bafu.admin.ch;https://www.bafu.admin.ch/bafu/de/home/zustand/indikatoren.html/
Wasser;Sanierung Fischgängigkeit (Fischaufstieg);;2024-10-07 00:00:00.000;Indikator;data@bafu.admin.ch;https://www.bafu.admin.ch/bafu/de/home/zustand/indikatoren.html/
Wasser;Sanierung Geschiebehaushalt Wasserkraft;;2024-10-08 00:00:00.000;Indikator;data@bafu.admin.ch;https://www.bafu.admin.ch/bafu/de/home/zustand/indikatoren.html/
Wasser;Sanierung Geschiebehaushalt Nicht-Wasserkraftanlagen;;2024-10-08 00:00:00.000;Indikator;data@bafu.admin.ch;https://www.bafu.admin.ch/bafu/de/home/zustand/indikatoren.html/
Wasser;Revitalisierte Fliessgewässer und Seeufer;;2024-09-30 00:00:00.000;Indikator;data@bafu.admin.ch;https://www.bafu.admin.ch/bafu/de/home/zustand/indikatoren.html/
Naturgefahren;Schluesselfragen;;2024-02-02 16:22:54.000;Daten von Webseite;Maike Schneider;https://www.bafu.admin.ch/dam/bafu/de/dokumente/naturgefahren/fachinfo-daten/schluesselfragen.xlsx
Biodiversität;Uv 2411 Rl Laufkaefer;;2024-10-29 08:44:23.000;Daten von Webseite;Hofmann Danielle BAFU;https://www.bafu.admin.ch/dam/bafu/de/dokumente/biodiversitaet/uv-umwelt-vollzug/UV-2411-RL-Laufkaefer.xlsx.download.xlsx/UV-2411-RL-Laufkaefer.xlsx
Naturgefahren;Schluesselfragen;;2024-01-26 09:34:31.000;Daten von Webseite;Maike Schneider;https://www.bafu.admin.ch/dam/bafu/fr/dokumente/naturgefahren/fachinfo-daten/schluesselfragen.xlsx
Klima;Anhang E Excel Toolmitformularenaundbzurwirkungsaufteilung;;2022-05-05 06:50:21.000;Daten von Webseite;Donald Sigrist;https://www.bafu.admin.ch/dam/bafu/en/dokumente/klima/uv-umwelt-vollzug/anhang_e_excel-toolmitformularenaundbzurwirkungsaufteilung.xlsx.download.xlsx/anhang_e_excel-toolmitformularenaundbzurwirkungsaufteilung.xlsx
Klima;Anhang M Beispiel En;;2022-04-28 09:08:56.000;Daten von Webseite;;https://www.bafu.admin.ch/dam/bafu/en/dokumente/klima/uv-umwelt-vollzug/anhang-m-beispiel-monitorindaten.xlsx.download.xlsx/Anhang_M_Beispiel_EN.xlsx
Wirtschaft und Konsum;Excel Erhebungsformular Gastronomie;;2024-12-24 08:55:46.000;Daten von Webseite;Schröter Ladina BAFU;https://www.bafu.admin.ch/dam/bafu/de/dokumente/wirtschaft-konsum/fachinfo-daten/excel_erhebungsformular_gastronomie.xlsx.download.xlsx/excel_erhebungsformular_gastronomie.xlsx
Abfall;Muster Bab Kommunale Abfallwirtschaft Hrm2 Bafu 2018;;2018-12-12 14:24:44.000;Daten von Webseite;swissplan.ch;https://www.bafu.admin.ch/dam/bafu/de/dokumente/abfall/fachinfo-daten/muster-bab-hrm2.xlsx.download.xlsx/Muster%20BAB%20kommunale%20Abfallwirtschaft%20HRM2%20BAFU%202018.xlsx
Abfall;Kopie Von Muster Bab Kommunale Abfallwirtschaft Hrm1 Bafu 2018;;2018-12-12 14:26:26.000;Daten von Webseite;swissplan.ch;https://www.bafu.admin.ch/dam/bafu/de/dokumente/abfall/fachinfo-daten/muster-bab-hrm1.xlsx.download.xlsx/Kopie%20von%20Muster-BAB_kommunale_Abfallwirtschaft_HRM1_BAFU_2018.xlsx
Biodiversität;Liste Der National Prioritären Arten;;2022-07-05 13:08:44.000;Daten von Webseite;francis.cordillot@bafu.admin.ch;https://www.bafu.admin.ch/dam/bafu/de/dokumente/biodiversitaet/uv-umwelt-vollzug/liste-der-prioritaeren-arten.xlsx.download.xlsx/Liste%20der%20National%20Priorit%C3%A4ren%20Arten.xlsx
Biodiversität;Digitale Liste Der National Prioritären Lebensräume;;2022-07-05 13:27:43.000;Daten von Webseite;francis.cordillot@bafu.admin.ch;https://www.bafu.admin.ch/dam/bafu/de/dokumente/biodiversitaet/uv-umwelt-vollzug/liste-der-prioritaeren-lebensraeume.xlsx.download.xlsx/Digitale%20Liste%20der%20National%20Priorit%C3%A4ren%20%20Lebensr%C3%A4ume.xlsx
Biodiversität;Aueninventar Stand Und Handlungsbedarf Datentabellen 201104;;2021-03-15 13:25:41.000;Daten von Webseite;Leslie Bonnard;https://www.bafu.admin.ch/dam/bafu/de/dokumente/biodiversitaet/fachinfo-daten/aueninventar-stand-und-handlungsbedarf.xlsx.download.xlsx/Aueninventar_Stand%20und%20Handlungsbedarf_Datentabellen_201104.xlsx
Biodiversität;Aufwertungsbedarf In Den Auen Von Nationaler Bedeutung, Datentabellen, Aktualisierung 2018;;2021-03-15 15:37:53.000;Daten von Webseite;;https://www.bafu.admin.ch/dam/bafu/de/dokumente/biodiversitaet/externe-studien-berichte/aufwertungsbedarf-in-den-auen-von-nationaler-bedeutung-datentabellen-aktualisierung-2018.xlsx.download.xlsx/Aufwertungsbedarf%20in%20den%20Auen%20von%20nationaler%20Bedeutung,%20Datentabellen,%20Aktualisierung%202018.xlsx
Biodiversität;Liste Der Waldzielarten;;2015-09-24 08:00:05.000;Daten von Webseite;U80824250;https://www.bafu.admin.ch/dam/bafu/de/dokumente/biodiversitaet/fachinfo-daten/liste_der_waldzielarten.xlsx.download.xlsx/liste_der_waldzielarten.xlsx
Biodiversität;Auswertungsstatistikderwaldzielarten;;2015-09-24 08:03:10.000;Daten von Webseite;Claudia Huber;https://www.bafu.admin.ch/dam/bafu/de/dokumente/biodiversitaet/fachinfo-daten/auswertungsstatistikderwaldzielarten.xlsx.download.xlsx/auswertungsstatistikderwaldzielarten.xlsx
Biodiversität;National Prioritäre Arten, Revidierte Version, Stand 30 06 2019;;2019-06-07 08:48:07.000;Daten von Webseite;francis.cordillot@bafu.admin.ch;https://www.bafu.admin.ch/dam/bafu/de/dokumente/biodiversitaet/fachinfo-daten/liste-der-national-prioritaeren-arten.xlsx.download.xlsx/National%20Priorit%C3%A4re%20Arten,%20Revidierte%20Version,%20Stand%2030.06.2019.xlsx
Biodiversität;Teil Ii Uv 1709 Npa Npl Dfi Digitaleliste Lebensraeume 21 06 2019;;2019-06-21 11:50:06.000;Daten von Webseite;francis.cordillot@bafu.admin.ch;https://www.bafu.admin.ch/dam/bafu/de/dokumente/biodiversitaet/fachinfo-daten/digitale-liste-der-npa-lebensraeume.xlsx.download.xlsx/Teil_II-UV-1709-NPA_NPL-DFI_DigitaleListe_Lebensraeume_21.06.2019.xlsx
Biodiversität;Teil I Uv 1709 Npa Npl Dfi Digitaleliste Arten 21 06 2019;;2019-06-21 11:48:58.000;Daten von Webseite;francis.cordillot@bafu.admin.ch;https://www.bafu.admin.ch/dam/bafu/de/dokumente/biodiversitaet/fachinfo-daten/digitale-liste-der-npa-arten.xlsx.download.xlsx/Teil_I-UV-1709-NPA_NPL-DFI_DigitaleListe_Arten_21.06.2019.xlsx
Chemikalien;Swissprtr Daten 2007 2022;;2025-03-24 15:09:47.000;Daten von Webseite;Apache POI;https://www.bafu.admin.ch/dam/bafu/de/dokumente/chemikalien/fachinfo-daten/swissprtr-daten-2007-2021.xlsx.download.xlsx/SwissPRTR-Daten_2007-2022.xlsx
Elektrosmog und Licht;Complete List Of References;;2025-04-15 10:36:01.000;Daten von Webseite;maurane;https://www.bafu.admin.ch/dam/bafu/de/dokumente/elektrosmog/fachinfo-daten/Complete%20list%20of%20references.xlsx.download.xlsx/Complete%20list%20of%20references.xlsx
innovation;Zwischenabrechnung;;2018-03-05 14:40:06.000;Daten von Webseite;openpyxl;https://www.bafu.admin.ch/dam/bafu/de/dokumente/innovation/fachinfo-daten/zwischenabrechnung-utf.xlsx.download.xlsx/Zwischenabrechnung.xlsx
innovation;Zwischenabrechnung Projektstart Ab 2019;;2020-10-14 07:18:11.000;Daten von Webseite;Frei Ming Ursula BAFU;https://www.bafu.admin.ch/dam/bafu/de/dokumente/innovation/fachinfo-daten/zwischenabrechnung-utf-projektstartab2019.xlsx.download.xlsx/Zwischenabrechnung_Projektstart%20ab%202019.xlsx
innovation;Zwischenabrechnung Utf Projektstart Ab 2021;;2021-07-08 06:58:20.000;Daten von Webseite;Frei Ming Ursula BAFU;https://www.bafu.admin.ch/dam/bafu/de/dokumente/innovation/fachinfo-daten/zwischenabrechnung_utf_projektstart2021.xlsx.download.xlsx/Zwischenabrechnung%20UTF_Projektstart%20ab%202021.xlsx
innovation;Schlussabrechnung;;2018-03-05 14:39:52.000;Daten von Webseite;openpyxl;https://www.bafu.admin.ch/dam/bafu/de/dokumente/innovation/fachinfo-daten/schlussabrechnung-utf.xlsx.download.xlsx/Schlussabrechnung.xlsx
innovation;Schlussabrechnung Utf Projektstart Ab 2019;;2019-10-31 08:11:27.000;Daten von Webseite;Frei Ming Ursula BAFU;https://www.bafu.admin.ch/dam/bafu/de/dokumente/innovation/fachinfo-daten/schlussabrechnung_utf_projektstartab2019.xlsx.download.xlsx/Schlussabrechnung%20UTF_Projektstart%20ab%202019.xlsx
